{
  "version": "3.0.0",
  "profile": "core-v1",
  "producer": {
    "name": "fortemi",
    "version": "2027.1.0",
    "revision": "fixture-next-major"
  },
  "format": "matric-shard",
  "created_at": "2027-01-01T00:00:00Z",
  "min_reader_version": "3.0.0",
  "components": ["notes"],
  "counts": {
    "notes": 0,
    "collections": 0,
    "tags": 0,
    "templates": 0,
    "links": 0,
    "embedding_sets": 0,
    "embedding_set_members": 0,
    "embeddings": 0,
    "embedding_configs": 0
  },
  "checksums": {
    "notes.jsonl": "e3b0c44298fc1c149afbf4c8996fb92427ae41e4649b934ca495991b7852b855"
  }
}
